description,code,primary_components,secondary_components,tertiary_components,system,feedstock,scale,efficiency,CAPEX_USD2015kW,LT_yr,O&M_%,IR_%,reference
,SUPPLY_COOLING_AS0,-,-,-,NONE,NONE,NONE,0.0,0,20,1.0,3,interest_rate = maximum 2 right now (https://www.visualcapitalist.com/chart-the-downward-spiral-in-interest-rates/) / Natalia Borzino: 3% discoutn rate (natalia.borzino@frs.ethz.ch)
Vapor compression chiller and dry cooling tower (building scale),SUPPLY_COOLING_AS1,CH2,-,CT2,COOLING,GRID,BUILDING,2.7458248750780765,710,20,3.0,3,"efficiency: "" BCA: Listing of Building Energy Performance Data for 2018 averaged 'Centralised Air-conditioning Plant Efficiency (kW/RT)' values of all benchmarked Air  Cooled Chilled Water Plant"" O&m_%: ""Quatar: District Cooling Service - Presentation to Qatar Rail https://de.slideshare.net/JaygopalKottilil/district-cooling-service-presentation-to-qatar-rail-47232121"""
Vapor compression chiller and wet cooling tower (building scale),SUPPLY_COOLING_AS2,CH2,-,CT1,COOLING,GRID,BUILDING,3.88,852,20,4.0,3,"efficiency: ""Statistical Analysis of VCC+CT simulations using CEAs decentralized optimization script, with the consideration of partial loads""; CAPEX_USD2015: ""Construction Cost Handbook Singapore 2016 (Arcadis) """
Vapor compression chiller and sea water heat exchanger (district scale),SUPPLY_COOLING_AS3,CH1,-,HEX1,COOLING,GRID,DISTRICT,6.5,1944,50,2.5,3,"efficiency: ""Choosing heat sinks for cooling in tropical climates. Bruelisauer et al. (2013)"" CAPEX_USD2015: ""FINAL FEASIBILITY REPORT Male’ and Hulhumale´ District Cooling Feasibility Study, devcco, ASHRAE District Cooling Guide 2013, Construction Cost Handbook Singapore 2016 (Arcadis) """
Vapor compression chiller and wet cooling tower (district scale),SUPPLY_COOLING_AS4,CH1,-,CT1,COOLING,GRID,DISTRICT,4.64,1514,50,2.0,3,"efficiency: ""Statistical Analysis of VCC+CT district cooling plant using CEAs centralized optimization script, with the consideration of partial loads""
CAPEX_USD2015: ""ASHRAE District Cooling Guide 2013, Construction Cost Handbook Singapore 2016 (Arcadis) """
Direct Expansion Unit (building scale),SUPPLY_COOLING_AS5,AC1,-,-,COOLING,GRID,BUILDING,2.3,271,15,12.0,3,"efficiency: ""Stuck-effect Units from: Stuck in a stack—Temperature measurements of the microclimate around split type condensing units in a high rise building in Singapore. Marcel Bruelisauer et al""
CAPEX_USD2015kW: ""https://www.lazada.sg/products/mitsubishi-starmex-inverter-system-3-air-conditioner-with-installation-i321630204-s640522722.html?spm=a2o42.searchlist.list.13.64e653b6LB0WXz&search=1""
"
